{
  "contractAddress": "0xf836a500910453A397084ADe41321ee20a5AAde1",
  "assetId": "WRESSLE-1-ROYALTY-4.5",
  "symbol": "ALB-WR1-R1",
  "releaseName": "Community Preview 1",
  "tokenType": "royalty",
  "firstPaymentDate": "2025-05",
  "sharePercentage": 2.5,
  "payoutData": [
    {
      "month": "2025-08",
      "tokenPayout": {
        "date": "2025-09-17T12:00:00Z",
        "totalPayout": 163.60,
        "payoutPerToken": 0.01361,
        "txHash": "0x"
      }
    }
  ],
  "asset": {
    "assetName": "Wressle-1 4.5% Royalty Stream",
    "description": "Onshore conventional oil field near Scunthorpe, North Lincolnshire, producing light Brent-linked crude from the Ashover Grit reservoir.",
    "status": "producing",
    "location": {
      "state": "East Midlands",
      "county": "Lincolnshire",
      "country": "United Kingdom",
      "coordinates": {
        "lat": 53.58,
        "lng": -0.544
      }
    },
    "operator": {
      "name": "Egdon Resources",
      "website": "https://www.egdon-resources.com"
    },
    "technical": {
      "fieldType": "Conventional Oil",
      "license": "PEDL180/PEDL182",
      "firstOil": "2021-01",
      "infrastructure": "HDPE-lined production site, trucked oil export and planned gas export pipeline",
      "environmental": "Full regulatory compliance; active Community Liaison Group",
      "expectedEndDate": "2027-12",
      "crudeBenchmark": "Brent",
      "pricing": {
        "benchmarkPremium": -1.3,
        "transportCosts": 0
      }
    },
    "assetTerms": {
      "interestType": "Royalty",
      "amount": 4.5
    },
    "plannedProduction": {
      "oilPriceAssumption": 65,
      "projections": [
        {
          "month": "2025-05",
          "production": 347.76
        },
        {
          "month": "2025-06",
          "production": 330.885
        },
        {
          "month": "2025-07",
          "production": 336.24
        },
        {
          "month": "2025-08",
          "production": 330.615
        },
        {
          "month": "2025-09",
          "production": 314.64
        },
        {
          "month": "2025-10",
          "production": 319.725
        },
        {
          "month": "2025-11",
          "production": 304.245
        },
        {
          "month": "2025-12",
          "production": 302.85
        },
        {
          "month": "2026-01",
          "production": 297.72
        },
        {
          "month": "2026-02",
          "production": 252.675
        },
        {
          "month": "2026-03",
          "production": 280.08
        },
        {
          "month": "2026-04",
          "production": 136.26
        },
        {
          "month": "2026-05",
          "production": 397.125
        },
        {
          "month": "2026-06",
          "production": 339.75
        },
        {
          "month": "2026-07",
          "production": 328.095
        },
        {
          "month": "2026-08",
          "production": 305.1
        },
        {
          "month": "2026-09",
          "production": 301.32
        },
        {
          "month": "2026-10",
          "production": 317.025
        },
        {
          "month": "2026-11",
          "production": 307.665
        },
        {
          "month": "2026-12",
          "production": 311.355
        },
        {
          "month": "2027-01",
          "production": 273.96
        },
        {
          "month": "2027-02",
          "production": 221.58
        },
        {
          "month": "2027-03",
          "production": 229.14
        },
        {
          "month": "2027-04",
          "production": 219.375
        },
        {
          "month": "2027-05",
          "production": 227.655
        },
        {
          "month": "2027-06",
          "production": 217.08
        },
        {
          "month": "2027-07",
          "production": 217.755
        },
        {
          "month": "2027-08",
          "production": 203.85
        },
        {
          "month": "2027-09",
          "production": 184.455
        },
        {
          "month": "2027-10",
          "production": 177.885
        },
        {
          "month": "2027-11",
          "production": 159.84
        },
        {
          "month": "2027-12",
          "production": 151.02
        }
      ]
    },
    "historicalProduction": [
      {
        "month": "2022-07",
        "production": 1056.24
      },
      {
        "month": "2022-08",
        "production": 973.4
      },
      {
        "month": "2022-09",
        "production": 976.86
      },
      {
        "month": "2022-10",
        "production": 978.78
      },
      {
        "month": "2022-11",
        "production": 494.68
      },
      {
        "month": "2022-12",
        "production": 1078.5
      },
      {
        "month": "2023-01",
        "production": 1139.47
      },
      {
        "month": "2023-02",
        "production": 1055.11
      },
      {
        "month": "2023-03",
        "production": 1053.78
      },
      {
        "month": "2023-04",
        "production": 1054.78
      },
      {
        "month": "2023-05",
        "production": 1065.65
      },
      {
        "month": "2023-06",
        "production": 1065.05
      },
      {
        "month": "2023-07",
        "production": 847.22
      },
      {
        "month": "2023-08",
        "production": 329.57
      },
      {
        "month": "2023-09",
        "production": 3.2
      },
      {
        "month": "2023-10",
        "production": 0
      },
      {
        "month": "2023-11",
        "production": 627.21
      },
      {
        "month": "2023-12",
        "production": 601.45
      },
      {
        "month": "2024-01",
        "production": 833.43
      },
      {
        "month": "2024-02",
        "production": 640.83
      },
      {
        "month": "2024-03",
        "production": 699.18
      },
      {
        "month": "2024-04",
        "production": 597.04
      },
      {
        "month": "2024-05",
        "production": 524.62
      },
      {
        "month": "2024-06",
        "production": 487.74
      },
      {
        "month": "2024-07",
        "production": 533.83
      },
      {
        "month": "2024-08",
        "production": 523.14
      },
      {
        "month": "2024-09",
        "production": 507.52
      },
      {
        "month": "2024-10",
        "production": 424.06
      },
      {
        "month": "2024-11",
        "production": 451.11
      },
      {
        "month": "2024-12",
        "production": 328.66
      },
      {
        "month": "2025-01",
        "production": 374.09
      },
      {
        "month": "2025-02",
        "production": 455.76
      },
      {
        "month": "2025-03",
        "production": 435.78
      },
      {
        "month": "2025-04",
        "production": 408.51
      },
      {
        "month": "2025-05",
        "production": 428.26
      }
    ],
    "receiptsData": [
      {
        "month": "2025-05",
        "assetData": {
          "production": 428.26,
          "revenue": 30992,
          "expenses": 0,
          "netIncome": 30992
        },
        "realisedPrice": {
          "oilPrice": 72,
          "gasPrice": 3.1
        }
      },
      {
        "month": "2025-06",
        "assetData": {
          "production": 356.85,
          "revenue": 25040,
          "expenses": 0,
          "netIncome": 0
        },
        "realisedPrice": {
          "oilPrice": 70.17,
          "gasPrice": 3.1
        }
      },
      {
        "month": "2025-07",
        "assetData": {
          "production": 338.85,
          "revenue": 23614.71,
          "expenses": 0,
          "netIncome": 0
        },
        "realisedPrice": {
          "oilPrice": 69.69,
          "gasPrice": 3.1
        }
      }
    ],
    "operationalMetrics": {
      "uptime": {
        "percentage": 81.6,
        "unit": "percent",
        "period": "last_30_days"
      },
      "hseMetrics": {
        "incidentFreeDays": 90
      }
    },
    "documents": [],
    "coverImage": "bafybeigkcpm3sko6xfzaiauigrx7bhdnxw5kdki5dlsuucyutv4vkwoegm",
    "galleryImages": [
      {
        "title": "Site Overview",
        "caption": "View of the Wressle-1 facility",
        "url": "bafybeigkcpm3sko6xfzaiauigrx7bhdnxw5kdki5dlsuucyutv4vkwoegm"
      },
      {
        "title": "Wellhead",
        "url": "bafkreiaxetiz7vzzbbvfxlbcgx6e5pefs2ltyqbrjki7prigbq5odeak54",
        "caption": "Wressle-1 Wellhead"
      },
      {
        "title": "Site Inspection",
        "caption": "Typical workday at the site",
        "url": "bafkreibdiwe7ghz5t5awo45l6e27i7hg6n5z4niimhgaywnfk4pqa6bocm"
      },
      {
        "title": "Site-2",
        "caption": "Another view of the site",
        "url": "bafkreifkpa4hevlsrpoe43rh2rsxeynfcopojpj25tp3adgmmpajs7kdfm"
      }
    ]
  }
}